{
  "schema_version": "0.2.0",
  "as_of": "2026-08-14",
  "label": "Synthetic example A \u2014 laddered floor, basket held asset, proxy-ETF puts",
  "currency": "USD",
  "underlyings": {
    "REF": {
      "level": 7748.5,
      "level_source": "solved_from_options",
      "ratio_to_reference": 1.0,
      "dividend_yield": 0.012,
      "exercise_style": "european",
      "settlement": "cash"
    },
    "PXY": {
      "level": 774.85,
      "level_source": "observed_close",
      "ratio_to_reference": 0.1,
      "tracking_error_bps_annual": 4,
      "dividend_yield": 0.012,
      "exercise_style": "american",
      "settlement": "physical"
    }
  },
  "reference_id": "REF",
  "held_asset": {
    "kind": "basket",
    "weight": 0.981,
    "dividend_yield": 0.0104,
    "response": {
      "beta_down": 1.0,
      "beta_up": 1.0,
      "idio_vol_annual": 0.035,
      "source": "assumed"
    },
    "constituents": [
      {
        "weight": 0.082,
        "sector": "Information Technology",
        "name": "NAME-001"
      },
      {
        "weight": 0.071,
        "sector": "Information Technology",
        "name": "NAME-002"
      },
      {
        "weight": 0.055,
        "sector": "Communication Services",
        "name": "NAME-003"
      },
      {
        "weight": 0.041,
        "sector": "Consumer Discretionary",
        "name": "NAME-004"
      },
      {
        "weight": 0.038,
        "sector": "Financials",
        "name": "NAME-005"
      },
      {
        "weight": 0.713,
        "sector": "Various \u2014 178 further names collapsed for this example",
        "name": "NAME-006"
      }
    ]
  },
  "option_legs": [
    {
      "leg_id": "P1",
      "underlying_id": "PXY",
      "right": "put",
      "position": "long",
      "strike": 584.0,
      "expiry": "2027-03-31",
      "contracts": 6835,
      "multiplier": 100,
      "mark_per_unit": 5.9,
      "role": "floor"
    },
    {
      "leg_id": "P2",
      "underlying_id": "PXY",
      "right": "put",
      "position": "long",
      "strike": 598.0,
      "expiry": "2026-09-30",
      "contracts": 6835,
      "multiplier": 100,
      "mark_per_unit": 0.51,
      "role": "floor"
    },
    {
      "leg_id": "P3",
      "underlying_id": "PXY",
      "right": "put",
      "position": "long",
      "strike": 615.0,
      "expiry": "2026-12-31",
      "contracts": 6835,
      "multiplier": 100,
      "mark_per_unit": 3.98,
      "role": "floor"
    },
    {
      "leg_id": "P4",
      "underlying_id": "PXY",
      "right": "put",
      "position": "long",
      "strike": 672.0,
      "expiry": "2027-06-30",
      "contracts": 6835,
      "multiplier": 100,
      "mark_per_unit": 18.01,
      "role": "floor"
    },
    {
      "leg_id": "C1",
      "underlying_id": "REF",
      "right": "call",
      "position": "short",
      "strike": 7725.0,
      "expiry": "2026-08-19",
      "contracts": 909,
      "multiplier": 100,
      "mark_per_unit": 78.4,
      "role": "cap"
    },
    {
      "leg_id": "C2",
      "underlying_id": "REF",
      "right": "call",
      "position": "short",
      "strike": 7800.0,
      "expiry": "2026-08-24",
      "contracts": 909,
      "multiplier": 100,
      "mark_per_unit": 42.15,
      "role": "cap"
    },
    {
      "leg_id": "C3",
      "underlying_id": "REF",
      "right": "call",
      "position": "short",
      "strike": 7875.0,
      "expiry": "2026-08-28",
      "contracts": 909,
      "multiplier": 100,
      "mark_per_unit": 21.6,
      "role": "cap"
    }
  ],
  "capital": {
    "net_assets": 2160730000,
    "units_outstanding": 62500000,
    "cash_weight": 0.016,
    "expense_ratio": 0.0089
  },
  "market": {
    "risk_free_rate": 0.042,
    "day_count": "act/365"
  },
  "provenance": {
    "source": "hypothetical",
    "notes": "Numbers are invented to exercise the schema. Not a description of any real product."
  },
  "subject": {
    "ticker": "EXAMPLE-A",
    "issuer": "Not a real product",
    "note": "Invented figures. Subject fields are user-asserted and never used in computation."
  },
  "advertised": {
    "protection_pct": 0.1,
    "protection_kind": "floor",
    "source": "hypothetical fact sheet"
  }
}